15897D.tif|Fältritning. Sektion VI. Profil mellan Z och H. Skala 1:20. Sammansatt bild. Svenska Cypernexpeditionen Se också 13960D- 13963D._-_SMVK-MM-Cypern_-_15897D.tif
C06242.tif|Utställning på Liljevalchs Konsthall 1933. Utställningsvy. Stockholm. Svenska Cypernexpeditionen_-_SMVK-MM-Cypern_-_C06242.tif
C06802.tif|Lazaros. Mersinaki. Svenska Cypernexpeditionen_-_SMVK-MM-Cypern_-_C06802.tif
C03206.tif|Hus IV och V efter utgrävningen. Kythrea. Svenska Cypernexpeditionen_-_SMVK-MM-Cypern_-_C03206.tif
C03093.tif|Hellenistiska huset från väster. Mersinaki. Svenska Cypernexpeditionen_-_SMVK-MM-Cypern_-_C03093.tif
C02359.tif|Geometriska cementgolvet. Ajios Jakovos Svenska Cypernexpeditionen_-_SMVK-MM-Cypern_-_C02359.tif
C01801.tif|Helhetsbild. Ajia Irini. Svenska Cypernexpeditionen_-_SMVK-MM-Cypern_-_C01801.tif
C01253.tif|Grav 34, interiör, sarkofag. Marion. Svenska Cypernexpeditionen_-_SMVK-MM-Cypern_-_C01253.tif
C02264.tif|John Lidros filmar. Kition. Svenska Cypernexpeditionen_-_SMVK-MM-Cypern_-_C02264.tif
C02979.tif|Amathus. Grav 10, med täckstenar. Svenska Cypernexpeditionen_-_SMVK-MM-Cypern_-_C02979.tif
C06271.tif|Mätning på haremstak. Lapithos. Svenska Cypernexpeditionen_-_SMVK-MM-Cypern_-_C06271.tif
C06718.tif|Dagen efter 10-jubileét. Fr.v. Rosa Lindros, John Lindros, Margit (allt i allo på Posis), Alfred Westholm, Einar Gjerstad. Toulis framför. Stockholm. Svenska Cypernexpeditionen fråga_-_SMVK-MM-Cypern_-_C06718.tif
C00504.tif|Tälten. Vouni Svenska Cypernexpeditionen_-_SMVK-MM-Cypern_-_C00504.tif
C04937.tif|Souidos och Kakoulis lagar staty. Stockholm. Svenska Cypernexpeditionen_-_SMVK-MM-Cypern_-_C04937.tif
C06268.tif|Einar Gjerstad, vattenprov. Kerynia. Svenska Cypernexpeditionen_-_SMVK-MM-Cypern_-_C06268.tif
C06274.tif|Lapithos. Från byn. Svenska Cypernexpeditionen_-_SMVK-MM-Cypern_-_C06274.tif
C06291.tif|Ernst Kjellberg dricker saft. Nicosia. Svenska Cypernexpeditionen_-_SMVK-MM-Cypern_-_C06291.tif
C08270.tif|Brita. Stockholm Svenska Cypernexpeditionen_-_SMVK-MM-Cypern_-_C08270.tif
C01835.tif|Ajia Irini. No. 1998 in situ._-_SMVK-MM-Cypern_-_C01835.tif
C01138.tif|Grav 4, dromos. Marion. Svenska Cypernexpeditionen_-_SMVK-MM-Cypern_-_C01138.tif
C03542.tif|Grav 8, dörrpackning. Stylli. Svenska Cypernexpeditionen_-_SMVK-MM-Cypern_-_C03542.tif
C01263.tif|Marion. Sarkofag och dörrstenar till Gunnis grav. Svenska Cypernnexpeditionen._-_SMVK-MM-Cypern_-_C01263.tif
C00824.tif|Badstranden. Lambousa. Svenska Cypernexpeditionen_-_SMVK-MM-Cypern_-_C00824.tif
C02310.tif|Grav 11, fyndlagret från norr. Amathus Svenska Cypernexpeditionen_-_SMVK-MM-Cypern_-_C02310.tif
C08747.tif|Utställning ”Före Fidias”. Trädtabellen. Stockholm Svenska Cypernexpeditionen_-_SMVK-MM-Cypern_-_C08747.tif
C00576.tif|Badstranden, John Lindros. Vouni Svenska Cypernexpeditionen_-_SMVK-MM-Cypern_-_C00576.tif
C09180.tif|Fr.v. Doktor Schwabacher, fru Saether, lektor Roos. Stockholm Svenska Cypernexpeditionen_-_SMVK-MM-Cypern_-_C09180.tif
C08753.tif|Utställning ”Före Fidias”. Kruktabellen. Stockholm Svenska Cypernexpeditionen_-_SMVK-MM-Cypern_-_C08753.tif
C06084.tif|Vouni. Palatset från söder. Svenska Cypernexpeditionen_-_SMVK-MM-Cypern_-_C06084.tif
15901D.tif|Fältritning. Ajia Irini. Svenska Cypernexpeditionen._-_SMVK-MM-Cypern_-_15901D.tif
C01532.tif|Fröken Atterman, Erik Sjöqvist och John Lindros. St. Hilarion. Svenska Cypernexpeditionen_-_SMVK-MM-Cypern_-_C01532.tif
C01589.tif|Erik Sjöqvist och fröken Atterman med kameler. Karpassos. Svenska Cypernexpeditionen_-_SMVK-MM-Cypern_-_C01589.tif
C01441.tif|Arbetsstyrkan sista dagen. Vouni. Svenska Cypernexpeditionen_-_SMVK-MM-Cypern_-_C01441.tif
C02785.tif|Så här urskiljs en grop från den naturliga sanden. Mersinaki. Svenska Cypernexpeditionen_-_SMVK-MM-Cypern_-_C02785.tif
15905D.tif|Fältritning. Ajia Irini. Svenska Cypernexpeditionen._-_SMVK-MM-Cypern_-_15905D.tif
15895D.tif|Fältritning. Sektion IV. Profil mellan D och E. Skala 1:20. Sammansatt bild. Svenska Cypernexpeditionen Se också 13955D - 13958D._-_SMVK-MM-Cypern_-_15895D.tif
C02548.tif|Marion. T61, dromos. Svenska Cypernexpeditionen._-_SMVK-MM-Cypern_-_C02548.tif
C06075.tif|Kythrea. Grottan i Fylleri, uppstigningen. Svenska Cypernexpeditionen_-_SMVK-MM-Cypern_-_C06075.tif
C01145.tif|Kameler på Nicosiavägen. Marion. Svenska Cypernexpeditionen_-_SMVK-MM-Cypern_-_C01145.tif
C00828.tif|Dansen går. Macheras. Svenska Cypernexpeditionen_-_SMVK-MM-Cypern_-_C00828.tif
C01679.tif|Familjen Gjerstad. Petra Tou Limniti. Svenska Cypernexpeditionen_-_SMVK-MM-Cypern_-_C01679.tif
C01044.tif|Erik Sjöqvist och Alfred Westholm på svenska institutets gård. Nicosia. Svenska Cypernexpeditionen_-_SMVK-MM-Cypern_-_C01044.tif
C02536.tif|Fr.v. Erik Sjöqvist, Einar Gjerstad, Vivi Gjerstad, Stefan Gjerstad, John Lindros och Alfred Westholm. Ajia Irini. Svenska Cypernexpeditionen fråga_-_SMVK-MM-Cypern_-_C02536.tif
C00755.tif|Muktaren med fru. Ajios Jakovos Svenska Cypernexpeditionen_-_SMVK-MM-Cypern_-_C00755.tif
C02219.tif|Fynd in situ i rum 117. Vouni. Svenska Cypernexpeditionen_-_SMVK-MM-Cypern_-_C02219.tif
C06298.tif|Flickorna från Galini Vouni. Svenska Cypernexpeditionen_-_SMVK-MM-Cypern_-_C06298.tif
C09605.tif|Cypernsamlingen, julsnö. Stockholm Svenska Cypernexpeditionen_-_SMVK-MM-Cypern_-_C09605.tif
Csn027.tif|Byskolan Ajia Irini. Svenska Cypernexpeditionen_-_SMVK-MM-Cypern_-_Csn027.tif
C01710.tif|Situationsbild. Idalion. Svenska Cypernexpeditionen_-_SMVK-MM-Cypern_-_C01710.tif
C01210.tif|Grav 30, fynd in situ. Marion. Svenska Cypernexpeditionen_-_SMVK-MM-Cypern_-_C01210.tif
C04161.tif|Cholades. No 438 en face. Soli. Svenska Cypernexpeditionen_-_SMVK-MM-Cypern_-_C04161.tif
C01792.tif|Ruta L 11. Ajia Irini. Svenska Cypernexpeditionen_-_SMVK-MM-Cypern_-_C01792.tif
C00849.tif|Erik Sjöqvist vid västmuren. Idalion. Svenska Cypernexpeditionen_-_SMVK-MM-Cypern_-_C00849.tif
C01818.tif|Ruta L 10. Ajia Irini. Svenska Cypernexpeditionen_-_SMVK-MM-Cypern_-_C01818.tif
Csn153.tif|Rosa Lindros t.v. och Erik Sjöqvist t.h._-_SMVK-MM-Cypern_-_Csn153.tif
C00580.tif|Grav 14, huggningar i taket. Vouni Svenska Cypernexpeditionen_-_SMVK-MM-Cypern_-_C00580.tif
C00484.tif|Torget. Volvo ? Polis Svenska Cypernexpeditionen_-_SMVK-MM-Cypern_-_C00484.tif
C01046.tif|Institutet köper vin, Nicosia. Erik Sjöqvist och Alfred Westholm._-_SMVK-MM-Cypern_-_C01046.tif
C02479.tif|Einar och Vivi Gjerstad på besök. Ajia Irini. Svenska Cypernexpeditionen_-_SMVK-MM-Cypern_-_C02479.tif
C00381.tif|Grav 12, dromos. Milia. Svenska Cypernexpeditionen_-_SMVK-MM-Cypern_-_C00381.tif
C00226.tif|Teatern. Arbetet på orkestran från väster. Soli Svenska Cypernexpeditionen_-_SMVK-MM-Cypern_-_C00226.tif
C01756.tif|Kition. Jordprofil vid Postament 2. Svenska Cypernexpeditionen_-_SMVK-MM-Cypern_-_C01756.tif
C06845.tif|Utställning på Liljevalchs Konsthall 1933. Vouni 17. Stockholm. Svenska Cypernexpeditionen_-_SMVK-MM-Cypern_-_C06845.tif
C05055.tif|Utställning på Liljevalchs Konsthall._-_SMVK-MM-Cypern_-_C05055.tif
C01642.tif|Alfred Westholm. Mavro Keratas i stass. Vouni. Svenska Cypernexpeditionen_-_SMVK-MM-Cypern_-_C01642.tif
C08654.tif|Solstrålar i kruksalen. Stockholm Svenska Cypernexpeditionen_-_SMVK-MM-Cypern_-_C08654.tif
C01444.tif|John Lindros med skallarna från grav 8. Ajios Jakovos. Svenska Cypernexpeditionen_-_SMVK-MM-Cypern_-_C01444.tif
C00703.tif|Teatern, östra ingången. Alfred Westholm Soli. Svenska Cypernexpeditionen_-_SMVK-MM-Cypern_-_C00703.tif
C01711.tif|Kition, Bamboula fr S. Svenska Cypernexpeditionen_-_SMVK-MM-Cypern_-_C01711.tif
C01436.tif|John Lindros vid stora kartan. Vouni. Svenska Cypernexpeditionen_-_SMVK-MM-Cypern_-_C01436.tif
C06011.tif|Macheras. Livet på terrassen._-_SMVK-MM-Cypern_-_C06011.tif
C06267.tif|Ett tåg kommer lastat. Famagusta. Svenska Cypernexpeditionen_-_SMVK-MM-Cypern_-_C06267.tif
C01390.tif|Statyer i stengärdsgård. Oura. Svenska Cypernexpeditionen_-_SMVK-MM-Cypern_-_C01390.tif
C02510.tif|Grav 14, interiör. Enkomi. Svenska Cypernexpeditionen_-_SMVK-MM-Cypern_-_C02510.tif
C03256.tif|Flyttning efter slutad utgrävning. Vouni. Svenska Cypernexpeditionen_-_SMVK-MM-Cypern_-_C03256.tif
C01202.tif|Grav 16, dromos. Marion. Svenska Cypernexpeditionen_-_SMVK-MM-Cypern_-_C01202.tif
C06287.tif|John Lindros på fotografisk expedition. Macheras. Svenska Cypernexpeditionen_-_SMVK-MM-Cypern_-_C06287.tif
C02406.tif|Vouni-avdelningen lastar utanför Svenska institutet. Volvo. Nicosia. Svenska Cypernexpeditionen_-_SMVK-MM-Cypern_-_C02406.tif
C01279.tif|Arbetsbild. Marion. Svenska Cypernexpeditionen_-_SMVK-MM-Cypern_-_C01279.tif
C06421.tif|Skulptur, kalksten Svenska Cypernexpeditionen_-_SMVK-MM-Cypern_-_C06421.tif
C01726.tif|Kultrummet, stora depån, detalj. Kition. Svenska Cypernexpeditionen_-_SMVK-MM-Cypern_-_C01726.tif
C00253.tif|Teatern. Toulis vid stranden. Soli Svenska Cypernexpeditionen_-_SMVK-MM-Cypern_-_C00253.tif
Csn099.tif|Svenska Cypernexpeditionen fråga_-_SMVK-MM-Cypern_-_Csn099.tif
C01719.tif|Kition. Kultrummet, statyer in situ. Svenska Cypernexpeditionen_-_SMVK-MM-Cypern_-_C01719.tif
C08992.tif|Fru Saether. Stockholm Svenska Cypernexpeditionen_-_SMVK-MM-Cypern_-_C08992.tif
C02790.tif|Utsikt mot Vouni från tältet Mersinaki. Svenska Cypernexpeditionen_-_SMVK-MM-Cypern_-_C02790.tif
C02353.tif|Arbetsbild. Petra Tou Limniti Svenska Cypernexpeditionen_-_SMVK-MM-Cypern_-_C02353.tif
C01648.tif|Gipstransport. Vouni. Svenska Cypernexpeditionen_-_SMVK-MM-Cypern_-_C01648.tif
C08669.tif|Kythrea, grav 1, keramikgrupp Svenska Cypernexpeditionen_-_SMVK-MM-Cypern_-_C08669.tif
C09178.tif|Lektor Roos. Stockholm Svenska Cypernexpeditionen_-_SMVK-MM-Cypern_-_C09178.tif
C00959.tif|Grav 501 Lapithos. Svenska Cypernexpeditionen_-_SMVK-MM-Cypern_-_C00959.tif
C02394.tif|Chocolatas hus, salongen. Kition. Svenska Cypernexpeditionen_-_SMVK-MM-Cypern_-_C02394.tif
C02419.tif|L.C. III huset, arbetsbild. Ajia Irini. Svenska Cypernexpeditionen_-_SMVK-MM-Cypern_-_C02419.tif
C02555.tif|Akropolen från sydväst. Idalion. Svenska Cypernexpeditionen_-_SMVK-MM-Cypern_-_C02555.tif
C03205.tif|Bekkallouris, Kleanthis och Dragos. Soli. Svenska Cypernexpeditionen_-_SMVK-MM-Cypern_-_C03205.tif
C00642.tif|Stefan Gjerstad utanför huset. Vouni Svenska Cypernexpeditionen_-_SMVK-MM-Cypern_-_C00642.tif
C06074.tif|Kythrea. Fylleri från byn. Svenska Cypernexpeditionen_-_SMVK-MM-Cypern_-_C06074.tif
C05771.tif|Alfred Westholm. Stockholm. Svenska Cypernexpeditionen_-_SMVK-MM-Cypern_-_C05771.tif
C03978.tif|Teatern, Eisodos krypti. Soli Svenska Cypernexpeditionen_-_SMVK-MM-Cypern_-_C03978.tif
C00148.tif|No 409/94. Landskapsbild Svenska Cypernexpeditionen_-_SMVK-MM-Cypern_-_C00148.tif
C01717.tif|Kristos och Alfred Westholm fingräver. Kition. Svenska Cypernexpeditionen_-_SMVK-MM-Cypern_-_C01717.tif
C00652.tif|Eleni köket. Vouni Svenska Cypernexpeditionen_-_SMVK-MM-Cypern_-_C00652.tif
C00522.tif|Athenatemplet, genombrytningen av golvet i rum I. Vouni Svenska Cypernexpeditionen_-_SMVK-MM-Cypern_-_C00522.tif
C00511.tif|Slakt. Vouni Svenska Cypernexpeditionen_-_SMVK-MM-Cypern_-_C00511.tif
C01635.tif|Klart till månskens pick-nick. Alfred Westholm, Gudrun Otterman, John Lindros. Vouni. Svenska Cypernexpeditionen_-_SMVK-MM-Cypern_-_C01635.tif
C05768.tif|Einar Gjerstad. Stockholm. Svenska Cypernexpeditionen_-_SMVK-MM-Cypern_-_C05768.tif
C06086.tif|Vouni. Palatset från sydväst. Svenska Cypernexpeditionen_-_SMVK-MM-Cypern_-_C06086.tif
C09751.tif|Prästen och Einar Gjerstad. Mandres. Svenska Cypernexpeditionen_-_SMVK-MM-Cypern_-_C09751.tif
C02541.tif|Musik utanför Svenska Institutet. Nicosia. Erik Sjöqvist och Alfred Westholm. Svenska Cypernexpeditionen_-_SMVK-MM-Cypern_-_C02541.tif
C01759.tif|Öster om kultrummet I-III, djupgrävning. Kition. Svenska Cypernexpeditionen_-_SMVK-MM-Cypern_-_C01759.tif
C00762.tif|Koundouras gör kleftika. Soli. Svenska Cypernexpeditionen_-_SMVK-MM-Cypern_-_C00762.tif
C02784.tif|Grop H 14-15 efter utgrävningen. Mersinaki. Svenska Cypernexpeditionen_-_SMVK-MM-Cypern_-_C02784.tif
C02973.tif|Grav 2, dromos före öppnandet. Amathus. Svenska Cypernexpeditionen_-_SMVK-MM-Cypern_-_C02973.tif
C02787.tif|Jordprofil. Mersinaki. Svenska Cypernexpeditionen_-_SMVK-MM-Cypern_-_C02787.tif
C01491.tif|Statygärdsgården. Oura. Svenska Cypernexpeditionen_-_SMVK-MM-Cypern_-_C01491.tif
C00326.tif|_-_SMVK-MM-Cypern_-_C00326.tif
C01135.tif|Torgplatsen. Nicosia. Svenska Cypernexpeditionen_-_SMVK-MM-Cypern_-_C01135.tif
C00490.tif|Sydvästsluttningen. Vouni Svenska Cypernexpeditionen_-_SMVK-MM-Cypern_-_C00490.tif
C00378.tif|Ödsligt landskap med herdar. Fokas kapell i bakgrunden. Milia. Svenska Cypernexpeditionen_-_SMVK-MM-Cypern_-_C00378.tif
C02257.tif|Rum 11. Kition. Svenska Cypernexpeditionen_-_SMVK-MM-Cypern_-_C02257.tif
C00426.tif|Erik Sjöqvist Lapithos. Svenska Cypernexpeditionen_-_SMVK-MM-Cypern_-_C00426.tif
C03535.tif|Grävningsplatsen. Stylli. Svenska Cypernexpeditionen_-_SMVK-MM-Cypern_-_C03535.tif
C00622.tif|Grav 8, interiör. Vouni Svenska Cypernexpeditionen_-_SMVK-MM-Cypern_-_C00622.tif
Csn150.tif|Svenska Cypernexpeditionen fråga_-_SMVK-MM-Cypern_-_Csn150.tif
Csn003.tif|Arkeologerna flyter. Erik Sjöqvist, Alfred Westholm och Einar Gjerstad.Svenska Cypernexpeditionen_-_SMVK-MM-Cypern_-_Csn003.tif
C01036.tif|Snögubbe. Nicosia. Svenska Cypernexpeditionen_-_SMVK-MM-Cypern_-_C01036.tif
C01071.tif|Floden. Nicosia. Svenska Cypernexpeditionen_-_SMVK-MM-Cypern_-_C01071.tif
C02354.tif|Från havet. Petra Tou Limniti Svenska Cypernexpeditionen_-_SMVK-MM-Cypern_-_C02354.tif
C00015.tif|Erik Sjöqvist i grav 306. Lapithos. Svenska Cypernexpeditionen_-_SMVK-MM-Cypern_-_C00015.tif
C08205.tif|Caféveranda i Karavostasi. I mitten Einar Gjerstad i vit kostym, John Lindros med ryggen vänd hitåt, t.h. Rosa Lindros i vit hatt. Svenska Cypernexpeditionen_-_SMVK-MM-Cypern_-_C08205.tif
C02198.tif|Loures. Trench 1, cementgolv med kolonnbas in situ. Vouni. Svenska Cypernexpeditionen_-_SMVK-MM-Cypern_-_C02198.tif
C06752.tif|Einar Gjerstad i Loures. Vouni. Svenska Cypernexpeditionen_-_SMVK-MM-Cypern_-_C06752.tif
C02409.tif|Vivi Gjerstad rider kamel. Nicosia. Svenska Cypernexpeditionen_-_SMVK-MM-Cypern_-_C02409.tif
C06816.tif|Kristos och turkisk man. Ajios Jakovos. Svenska Cypernexpeditionen_-_SMVK-MM-Cypern_-_C06816.tif
C01252.tif|Grav 16, efter utgrävningen. Marion. Svenska Cypernexpeditionen_-_SMVK-MM-Cypern_-_C01252.tif
C02313.tif|Amathus. Grav 14 efter utgrävningen. Svenska Cypernexpeditionen_-_SMVK-MM-Cypern_-_C02313.tif
C10053.tif|Ernst Kjellberg._-_SMVK-MM-Cypern_-_C10053.tif
15907D.tif|Fältritning. Ajia Irini. Svenska Cypernexpeditionen._-_SMVK-MM-Cypern_-_15907D.tif
C04349.tif|Byskolan Ajia Irini. Svenska Cypernexpeditionen_-_SMVK-MM-Cypern_-_C04349.tif
C08748.tif|Utställning ”Före Fidias”. Graven. Stockholm Svenska Cypernexpeditionen_-_SMVK-MM-Cypern_-_C08748.tif
C06076.tif|Soli. Teatern. Svenska Cypernexpeditionen_-_SMVK-MM-Cypern_-_C06076.tif
C00880.tif|Panajiotis. Idalion. Svenska Cypernexpeditionen_-_SMVK-MM-Cypern_-_C00880.tif
C00388.tif|John Lindros. Nicosia Svenska Cypernexpeditionen_-_SMVK-MM-Cypern_-_C00388.tif
C02599.tif|Einar Gjerstad blir klippt. Nicosia. Svenska Cypernexpeditionen_-_SMVK-MM-Cypern_-_C02599.tif
C00995.tif|Svenska huset. Nicosia. Svenska Cypernexpeditionen_-_SMVK-MM-Cypern_-_C00995.tif
C03717.tif|Festbild. Galini. Svenska Cypernexpeditionen_-_SMVK-MM-Cypern_-_C03717.tif
C01670.tif|Fru Markides och Dikaios på besök. Vouni. Svenska Cypernexpeditionen_-_SMVK-MM-Cypern_-_C01670.tif
C04912.tif|Grav 2, interiör. Amathus. Svenska Cypernexpeditionen_-_SMVK-MM-Cypern_-_C04912.tif
C10056.tif|John Lindros. Lapithos. Svenska Cypernexpeditionen_-_SMVK-MM-Cypern_-_C10056.tif
C04140.tif|Cholades. Rum XLIII A, offergropen vid altare 154. Soli. Svenska Cypernexpeditionen_-_SMVK-MM-Cypern_-_C04140.tif
C02263.tif|John Lidros filmar. Kition. Svenska Cypernexpeditionen_-_SMVK-MM-Cypern_-_C02263.tif
C07184.tif|Ragnhild skriver uppsats. Stockholm. Svenska Cypernexpeditionen_-_SMVK-MM-Cypern_-_C07184.tif
15902D.tif|Fältritning. Ajia Irini. Svenska Cypernexpeditionen._-_SMVK-MM-Cypern_-_15902D.tif
C05973.tif|Rummet som John Lindros och Erik Sjöqvist använde vid H.K.H. ´s besök. Nicosia Svenska Cypernexpeditionen_-_SMVK-MM-Cypern_-_C05973.tif
C00704.tif|Teatern, scenens fasad. Alfred Westholm. Soli. Svenska Cypernexpeditionen_-_SMVK-MM-Cypern_-_C00704.tif
C00905.tif|John Lindros vid ritbordet. Nicosia Svenska Cypernexpeditionen_-_SMVK-MM-Cypern_-_C00905.tif
C05975.tif|Ombord på M/S Gotland. Famagusta. Svenska Cypernexpeditionen_-_SMVK-MM-Cypern_-_C05975.tif
C06010.tif|Livet på terrassen, huset. Macheras. Svenska Cypernexpeditionen_-_SMVK-MM-Cypern_-_C06010.tif
C05051.tif|Utställning på Liljevalchs Konsthall._-_SMVK-MM-Cypern_-_C05051.tif
C01102.tif|Erik Lindros, svenska institutet. Nicosia. Svenska Cypernexpeditionen_-_SMVK-MM-Cypern_-_C01102.tif
C00204.tif|Bysantinska murar. Soli Svenska Cypernexpeditionen_-_SMVK-MM-Cypern_-_C00204.tif
C00270.tif|Skulptur_-_SMVK-MM-Cypern_-_C00270.tif
C01312.tif|Grav 53, arbetsbild. Marion. Svenska Cypernexpeditionen_-_SMVK-MM-Cypern_-_C01312.tif
C00875.tif|Fynd i G 6-7 Idalion. Svenska Cypernexpeditionen_-_SMVK-MM-Cypern_-_C00875.tif
C01664.tif|Rum 129, statyanhopning. Vouni. Svenska Cypernexpeditionen_-_SMVK-MM-Cypern_-_C01664.tif
C00467.tif|Monasteraki, kolonn med kapitäl in situ. Soli Svenska Cypernexpeditionen_-_SMVK-MM-Cypern_-_C00467.tif
C00614.tif|Palatskullen förer utgrävningen. Vouni Svenska Cypernexpeditionen_-_SMVK-MM-Cypern_-_C00614.tif
C01011.tif|Svenska institutet. Nicosia. Svenska Cypernexpeditionen_-_SMVK-MM-Cypern_-_C01011.tif
C03712.tif|Afrodite Galini, in situ. Galini. Svenska Cypernexpeditionen_-_SMVK-MM-Cypern_-_C03712.tif
C05052.tif|Utställning på Liljevalchs Konsthall 1933. M.C. rummet. Stockholm. Svenska Cypernexpeditionen_-_SMVK-MM-Cypern_-_C05052.tif
C01344.tif|Marion. Morgonstämning. Svenska Cypernexpeditionen._-_SMVK-MM-Cypern_-_C01344.tif
C01708.tif|B.A.S. från öster. Ajios Jakovos. Svenska Cypernexpeditionen_-_SMVK-MM-Cypern_-_C01708.tif
C00483.tif|Teatern, fest på orkestran. Soli Svenska Cypernexpeditionen_-_SMVK-MM-Cypern_-_C00483.tif
C02770.tif|Utsikt mot Vouni från utgrävningen. Mersinaki. Svenska Cypernexpeditionen_-_SMVK-MM-Cypern_-_C02770.tif
C00412.tif|Grav 317, interiör. Lapithos. Svenska Cypernexpeditionen_-_SMVK-MM-Cypern_-_C00412.tif
C00798.tif|Lapithos, Plakes, landskapsbild från NO. Svenska Cypernexpeditionen_-_SMVK-MM-Cypern_-_C00798.tif
C08202.tif|Alfred Westholm utanför fästningsmuren. Kerynia. Svenska Cypernexpeditionen_-_SMVK-MM-Cypern_-_C08202.tif
C00834.tif|Souidos och V.39 hopsatt. Nicosia. Svenska Cypernexpeditionen_-_SMVK-MM-Cypern_-_C00834.tif
C02206.tif|Kristos och Alfred Westholm gräver statyer i rum 117. Vouni. Svenska Cypernexpeditionen_-_SMVK-MM-Cypern_-_C02206.tif
C02247.tif|J.A.S. Arkaiska templet från öster. Ajios Jakovos. Svenska Cypernexpeditionen_-_SMVK-MM-Cypern_-_C02247.tif
C00220.tif|Teatern. Arbete vid substruktionsmurarna till östra eisodos. Soli Svenska Cypernexpeditionen_-_SMVK-MM-Cypern_-_C00220.tif
C01010.tif|Cypernexpeditionen. Fr.v. John Lindros, Alfred Westholm, Erik Sjöqvist och Einar Gjerstad. Nicosia. Svenska Cypernexpeditionen_-_SMVK-MM-Cypern_-_C01010.tif
C00572.tif|Mavro Keratas. Vouni Svenska Cypernexpeditionen_-_SMVK-MM-Cypern_-_C00572.tif
C00852.tif|Fåraherde. Idalion. Svenska Cypernexpeditionen_-_SMVK-MM-Cypern_-_C00852.tif
C00993.tif|Martin och Stefan Gjerstad. Nicosia. Svenska Cypernexpeditionen_-_SMVK-MM-Cypern_-_C00993.tif
C01438.tif|Einar Gjerstad hissas ned i brunnen. Vouni. Svenska Cypernexpeditionen_-_SMVK-MM-Cypern_-_C01438.tif
C01343.tif|Einar Gjerstad på besök, Erik Sjöqvist. Marion. Svenska Cypernexpeditionen_-_SMVK-MM-Cypern_-_C01343.tif
C01345.tif|Grav 67, skelett in situ. Marion. Svenska Cypernexpeditionen_-_SMVK-MM-Cypern_-_C01345.tif
C00124.tif|Lapithos, landskapsbild. Svenska Cypernexpeditionen_-_SMVK-MM-Cypern_-_C00124.tif
C02614.tif|Nekropolberget från söder. Paleoskoutella Svenska Cypernexpeditionen_-_SMVK-MM-Cypern_-_C02614.tif
C00628.tif|Från Solis akropol. Vouni Svenska Cypernexpeditionen_-_SMVK-MM-Cypern_-_C00628.tif
C01141.tif|Djurmasker, sista karnevalsdagen. Marion. Svenska Cypernexpeditionen_-_SMVK-MM-Cypern_-_C01141.tif
C02762.tif|Arbetsbild. Mersinaki. Svenska Cypernexpeditionen_-_SMVK-MM-Cypern_-_C02762.tif
C01709.tif|Akropolen från öster. Idalion. Svenska Cypernexpeditionen_-_SMVK-MM-Cypern_-_C01709.tif
Csn001.tif|Okänd. Nitovikla. Svenska Cypernexpeditionen_-_SMVK-MM-Cypern_-_Csn001.tif
C06241.tif|Utställning på Liljevalchs Konsthall 1933. Mersinaki rummet. Stockholm. Svenska Cypernexpeditionen_-_SMVK-MM-Cypern_-_C06241.tif
C00325.tif|Lapithos, No. 406/65. Svenska Cypernexpeditionen_-_SMVK-MM-Cypern_-_C00325.tif
C01812.tif|Arbetsbild. Ajia Irini. Svenska Cypernexpeditionen_-_SMVK-MM-Cypern_-_C01812.tif
C02289.tif|Grav 19, fynd in situ. Amathus Svenska Cypernexpeditionen_-_SMVK-MM-Cypern_-_C02289.tif
Csn147.tif|_-_SMVK-MM-Cypern_-_Csn147.tif
C00740.tif|Arbetsbild. Vouni. Svenska Cypernexpeditionen_-_SMVK-MM-Cypern_-_C00740.tif
C00759.tif|Från gravberget. Vouni. Svenska Cypernexpeditionen_-_SMVK-MM-Cypern_-_C00759.tif
C02540.tif|Gunnis med No A.I. 1728+1740 Nicosia. Svenska Cypernexpeditionen_-_SMVK-MM-Cypern_-_C02540.tif
C04895.tif|Souidos med lagad kruka. Stockholm Svenska Cypernexpeditionen_-_SMVK-MM-Cypern_-_C04895.tif
C05414.tif|Delar till brynja_-_SMVK-MM-Cypern_-_C05414.tif
C01774.tif|Kition. Herakles med altare, fr. N. Svenska Cypernexpeditionen_-_SMVK-MM-Cypern_-_C01774.tif
C03964.tif|Athena-templet från öster. Vouni. Svenska Cypernexpeditionen_-_SMVK-MM-Cypern_-_C03964.tif
C00925.tif|Måltid hos Demitri. Lapithos. Svenska Cypernexpeditionen_-_SMVK-MM-Cypern_-_C00925.tif
C00260.tif|Teatern. Stora profilen börjas på Terr III. Soli. Svenska Cypernexpeditionen_-_SMVK-MM-Cypern_-_C00260.tif
15898D.tif|Fältritning. Sektion XIII. Profil mellan 7 och 8. Skala 1:20. Svenska Cypernexpeditionen Sammansatt bild. Se även 13964D och 13965D._-_SMVK-MM-Cypern_-_15898D.tif
C01258.tif|Grav 32, nisch III oöppnad. Marion. Svenska Cypernexpeditionen_-_SMVK-MM-Cypern_-_C01258.tif
C00307.tif|Lapithos, arbetsbild. Svenska Cypernexpeditionen_-_SMVK-MM-Cypern_-_C00307.tif
15908D.tif|Fältritning. Ajia Irini. Svenska Cypernexpeditionen._-_SMVK-MM-Cypern_-_15908D.tif
C01639.tif|Från väster. Vouni. Svenska Cypernexpeditionen_-_SMVK-MM-Cypern_-_C01639.tif
C02449.tif|Ajia Irini. Altare 50, temenosmur, trådinhägnad från norr. Svenska Cypernexpeditionen._-_SMVK-MM-Cypern_-_C02449.tif
C06275.tif|Lapithos. Utsikt mot öster. Svenska Cypernexpeditionen_-_SMVK-MM-Cypern_-_C06275.tif
C01123.tif|Punktering, Volvo. Svenska Cypernexpeditionen_-_SMVK-MM-Cypern_-_C01123.tif
C01820.tif|Ruta K 10. Ajia Irini. Svenska Cypernexpeditionen_-_SMVK-MM-Cypern_-_C01820.tif
C01448.tif|Grav 14, interiör Ajios Jakovos. Svenska Cypernexpeditionen_-_SMVK-MM-Cypern_-_C01448.tif
C02565.tif|Grav 18, schaktet uppifrån. Enkomi. Svenska Cypernexpeditionen_-_SMVK-MM-Cypern_-_C02565.tif
C00761.tif|Westholm och Lindros utanför tältet. Vouni. Svenska Cypernexpeditionen_-_SMVK-MM-Cypern_-_C00761.tif
C01118.tif|Alfred Westholm, svenska institutet. Nicosia. Svenska Cypernexpeditionen_-_SMVK-MM-Cypern_-_C01118.tif
C09418.tif|Cypernutsällningen, östra stallet? Stockholm Svenska Cypernexpeditionen_-_SMVK-MM-Cypern_-_C09418.tif
C00705.tif|Teatern, orkestran och cavean. Alfred Westholm. Soli. Svenska Cypernexpeditionen_-_SMVK-MM-Cypern_-_C00705.tif
C00710.tif|Festgeten slaktas. Soli. Svenska Cypernexpeditionen_-_SMVK-MM-Cypern_-_C00710.tif
C00299.tif|Alfred Westholm konserverar krukor. Nicosia. Svenska Cypernexpeditionen_-_SMVK-MM-Cypern_-_C00299.tif
C02769.tif|Statyer i grop H 14-15. Mersinaki. Svenska Cypernexpeditionen_-_SMVK-MM-Cypern_-_C02769.tif
C00778.tif|Arbetsbild. Oura. Svenska Cypernexpeditionen_-_SMVK-MM-Cypern_-_C00778.tif
C01195.tif|Grav 22, interiör. Marion. Svenska Cypernexpeditionen_-_SMVK-MM-Cypern_-_C01195.tif
C04893.tif|Souidos med lagad staty. Stockholm Svenska Cypernexpeditionen_-_SMVK-MM-Cypern_-_C04893.tif
C01728.tif|Kultrummet, stora depån, detalj. Kition. Svenska Cypernexpeditionen_-_SMVK-MM-Cypern_-_C01728.tif
C00752.tif|Festgeten stekes. Galini. Svenska Cypernexpeditionen_-_SMVK-MM-Cypern_-_C00752.tif
C06420.tif|Skulptur, kalksten Svenska Cypernexpeditionen_-_SMVK-MM-Cypern_-_C06420.tif
C00639.tif|Athenatemplet, no. 152 in situ. Vouni Svenska Cypernexpeditionen_-_SMVK-MM-Cypern_-_C00639.tif
C01804.tif|Helhetsbild. Ajia Irini. Svenska Cypernexpeditionen_-_SMVK-MM-Cypern_-_C01804.tif
C00813.tif|Lapitos. Grävningsplatsen i Ajia Anastasia. Svenska Cypernexpeditionen_-_SMVK-MM-Cypern_-_C00813.tif
C00868.tif|Kultdepån i K 7. Idalion. Svenska Cypernexpeditionen_-_SMVK-MM-Cypern_-_C00868.tif
C00419.tif|Christoforos Kafenion. Erik Sjöqvist och John Lindros i bakgrunden. Rosa Lindros t.v. i vit hatt mellan borgmästare Kaplanis och Dimitrakis. Lapithos. Svenska Cypernexpeditionen_-_SMVK-MM-Cypern_-_C00419.tif
C02488.tif|Jordgrav. Enkomi. Svenska Cypernexpeditionen_-_SMVK-MM-Cypern_-_C02488.tif
C06758.tif|Bilmissöde, Volvo. Kythrea. Svenska Cypernexpeditionen_-_SMVK-MM-Cypern_-_C06758.tif
C02767.tif|Statyanhopning i K 17-18 Mersinaki. Svenska Cypernexpeditionen_-_SMVK-MM-Cypern_-_C02767.tif
C01606.tif|Erik Sjöqvist, Vivi Gjerstad ? och John Lindros. God mat. Boghy. Svenska Cypernexpeditionen_-_SMVK-MM-Cypern_-_C01606.tif
C06082.tif|Palatset från väster. Vouni. Svenska Cypernexpeditionen_-_SMVK-MM-Cypern_-_C06082.tif
C05770.tif|Erik Sjöqvist. Stockholm. Svenska Cypernexpeditionen_-_SMVK-MM-Cypern_-_C05770.tif
C00756.tif|Krogbild. Ajios Jakovos Svenska Cypernexpeditionen_-_SMVK-MM-Cypern_-_C00756.tif
C01262.tif|Grav 25, interiör. Marion. Svenska Cypernexpeditionen_-_SMVK-MM-Cypern_-_C01262.tif
C00008.tif|Badstranden. Kyrenia. Svenska Cypernexpeditionen_-_SMVK-MM-Cypern_-_C00008.tif
