C03198.tif|Amathus. Grav 8, övre lagret. Svenska Cypernexpeditionen_-_SMVK-MM-Cypern_-_C03198.tif
C01427.tif|Grav 2, exteriör. Kountoura Trachonia. Svenska Cypernexpeditionen_-_SMVK-MM-Cypern_-_C01427.tif
C02446.tif|Profilkors vid stora vattenrännan. Ajia Irini. Svenska Cypernexpeditionen_-_SMVK-MM-Cypern_-_C02446.tif
C02740.tif|Paradisiotissa. Templet från nordväst. Vouni. Svenska Cypernexpeditionen_-_SMVK-MM-Cypern_-_C02740.tif
C01640.tif|Fröken Atterman i rum 42. Vouni. Svenska Cypernexpeditionen_-_SMVK-MM-Cypern_-_C01640.tif
C01816.tif|Ruta L 9-10. Ajia Irini. Svenska Cypernexpeditionen_-_SMVK-MM-Cypern_-_C01816.tif
C01783.tif|Grav 7, interiör. Kountoura Trachonia. Svenska Cypernexpeditionen_-_SMVK-MM-Cypern_-_C01783.tif
C03873.tif|Skulptur_-_SMVK-MM-Cypern_-_C03873.tif
C02789.tif|Arbetsbild. Mersinaki. Svenska Cypernexpeditionen_-_SMVK-MM-Cypern_-_C02789.tif
C02192.tif|John Lindros fotograferar. Vouni. Svenska Cypernexpeditionen_-_SMVK-MM-Cypern_-_C02192.tif
C01286.tif|Grav 53, arbetsbild. Marion. Svenska Cypernexpeditionen_-_SMVK-MM-Cypern_-_C01286.tif
C00509.tif|Kristos, Westholm och Lazaros. Vouni Svenska Cypernexpeditionen_-_SMVK-MM-Cypern_-_C00509.tif
C00640.tif|Eleni diskar. Vouni Svenska Cypernexpeditionen_-_SMVK-MM-Cypern_-_C00640.tif
C00797.tif|Lapithos, Plakes, landskapsbild. Svenska Cypernexpeditionen_-_SMVK-MM-Cypern_-_C00797.tif
C08290.tif|Alfred Westholm och Knut Thyberg. Vouni. Svenska Cypernexpeditionen_-_SMVK-MM-Cypern_-_C08290.tif
C06765.tif|Grottan vid Fylleri. Utsikt. Kythrea. Svenska Cypernexpeditionen_-_SMVK-MM-Cypern_-_C06765.tif
C02459.tif|Nordmuren från väster. Ajia Irini. Svenska Cypernexpeditionen_-_SMVK-MM-Cypern_-_C02459.tif
C01185.tif|Cholades före utgrävningen. Soli. Svenska Cypernexpeditionen_-_SMVK-MM-Cypern_-_C01185.tif
C01034.tif|Alfred Westholm utanför svenska institutet. Nicosia. Svenska Cypernexpeditionen_-_SMVK-MM-Cypern_-_C01034.tif
C00816.tif|Avfärden. Lapithos. Svenska Cypernexpeditionen_-_SMVK-MM-Cypern_-_C00816.tif
15899D.tif|Fältritning. Svenska Cypernexpeditionen._-_SMVK-MM-Cypern_-_15899D.tif
C02410.tif|Vivi Gjerstad rider kamel. Nicosia. Svenska Cypernexpeditionen_-_SMVK-MM-Cypern_-_C02410.tif
C02480 a-b.tif|Sammansättningsbild. Temenos från sydöst. Ajia Irini. Svenska Cypernexpeditionen_-_SMVK-MM-Cypern_-_C02480 a-b.tif
C09182.tif|Cypern utställningen i Historiska Museet._-_SMVK-MM-Cypern_-_C09182.tif
15896D.tif|Fältritning. Sektion V. Profil mellan E och Z. Svenska Cypernexpeditionen_-_SMVK-MM-Cypern_-_15896D.tif
C00777.tif|Landskap. Oura. Svenska Cypernexpeditionen_-_SMVK-MM-Cypern_-_C00777.tif
C02782.tif|Fynd in situ i grop H 14-15. Mersinaki. Svenska Cypernexpeditionen_-_SMVK-MM-Cypern_-_C02782.tif
C06077.tif|Soli. Teatern. Svenska Cypernexpeditionen_-_SMVK-MM-Cypern_-_C06077.tif
C09763.tif|Kastning av säd. Kerynia Svenska Cypernexpeditionen_-_SMVK-MM-Cypern_-_C09763.tif
C00865.tif|Murar i L 8. Idalion. Svenska Cypernexpeditionen_-_SMVK-MM-Cypern_-_C00865.tif
C03628.tif|Cholades. Tempel E, översiktsbild från väster. Soli. Svenska Cypernexpeditionen_-_SMVK-MM-Cypern_-_C03628.tif
C00754.tif|Muktarens praktrum. Milia. Svenska Cypernexpeditionen_-_SMVK-MM-Cypern_-_C00754.tif
C06078.tif|Vouni. Utsikt mot Petra. Svenska Cypernexpeditionen_-_SMVK-MM-Cypern_-_C06078.tif
C03605.tif|Akropolen från nordväst. Soli. Svenska Cypernexpeditionen_-_SMVK-MM-Cypern_-_C03605.tif
C02771.tif|Till vänster K 17-18 utgrävt, resten K 19-21. Mersinaki. Svenska Cypernexpeditionen_-_SMVK-MM-Cypern_-_C02771.tif
C02360.tif|Alfred Westholm vid skrivbordet. Vouni. Svenska Cypernexpeditionen_-_SMVK-MM-Cypern_-_C02360.tif
C00646.tif|Gjerstad och Westholm dricker te. Vouni Svenska Cypernexpeditionen_-_SMVK-MM-Cypern_-_C00646.tif
C00936.tif|Lapitos, fr S. Från bergen mot havet. Svenska Cypernexpeditionen_-_SMVK-MM-Cypern_-_C00936.tif
C06240.tif|Utställning på Liljevalchs Konsthall 1933. Mersinaki rummet. Stockholm. Svenska Cypernexpeditionen_-_SMVK-MM-Cypern_-_C06240.tif
C01490.tif|Lägret. Oura. Svenska Cypernexpeditionen_-_SMVK-MM-Cypern_-_C01490.tif
C02316.tif|Amathus. Grav 22, täckhällarna. Svenska Cypernexpeditionen_-_SMVK-MM-Cypern_-_C02316.tif
C01372.tif|Entrén. Nitovikla Svenska Cypernexpeditionen_-_SMVK-MM-Cypern_-_C01372.tif
C06685.tif|Stockholm, Posis. Ie's sommarstass_-_SMVK-MM-Cypern_-_C06685.tif
C09752.tif|Erik Sjöqvist, prästen och Einar Gjerstad. Mandres. Svenska Cypernexpeditionen_-_SMVK-MM-Cypern_-_C09752.tif
C02539.tif|Papa Prokopios klämtar i klockan. Ajia Irini. Svenska Cypernexpeditionen_-_SMVK-MM-Cypern_-_C02539.tif
15912D.tif|Fältritning. Ajia Irini. Svenska Cypernexpeditionen._-_SMVK-MM-Cypern_-_15912D.tif
C00650.tif|Vivi Gjerstad under Charoupiaträdet. Vouni Svenska Cypernexpeditionen_-_SMVK-MM-Cypern_-_C00650.tif
C00725.tif|Galini. Festmåltid. Svenska Cypernexpeditionen_-_SMVK-MM-Cypern_-_C00725.tif
C05060.tif|Utställning på Liljevalchs Konsthall._-_SMVK-MM-Cypern_-_C05060.tif
C00881.tif|Panajiotis hus, på trappan. Idalion. Svenska Cypernexpeditionen_-_SMVK-MM-Cypern_-_C00881.tif
C05061.tif|Utställning på Liljevalchs Konsthall 1933. Vouni rummet. Stockholm. Svenska Cypernexpeditionen_-_SMVK-MM-Cypern_-_C05061.tif
C01811.tif|Arbetsbild. Erik Sjöqvist. Ajia Irini. Svenska Cypernexpeditionen_-_SMVK-MM-Cypern_-_C01811.tif
C00200.tif|Teatern, Evagoras i östra parados. Soli Svenska Cypernexpeditionen_-_SMVK-MM-Cypern_-_C00200.tif
C01766.tif|Kultrummet utgrävt från norr. Kition. Svenska Cypernexpeditionen_-_SMVK-MM-Cypern_-_C01766.tif
C06072.tif|Mynningen av grotta i Fylleri. Kythrea. Svenska Cypernexpeditionen_-_SMVK-MM-Cypern_-_C06072.tif
C03037.tif|Herakleskapellet efter utgrävningen. Vouni. Svenska Cypernexpeditionen fråga_-_SMVK-MM-Cypern_-_C03037.tif
C00508.tif|Familjen Gjerstad utanför tälten. Vouni Svenska Cypernexpeditionen_-_SMVK-MM-Cypern_-_C00508.tif
C03528.tif|Grav 19, interiör. Stylli. Svenska Cypernexpeditionen_-_SMVK-MM-Cypern_-_C03528.tif
C00908.tif|Julafton 1927, frukostbordet Nicosia Svenska Cypernexpeditionen_-_SMVK-MM-Cypern_-_C00908.tif
C00821.tif|Lapithos, lanskapsbild. Svenska Cypernexpeditionen_-_SMVK-MM-Cypern_-_C00821.tif
C01782.tif|Grav 7, exteriör. Kountoura Trachonia. Svenska Cypernexpeditionen_-_SMVK-MM-Cypern_-_C01782.tif
C06273.tif|Lapithos. Från byn. Svenska Cypernexpeditionen_-_SMVK-MM-Cypern_-_C06273.tif
C01430.tif|Grav 7 från sydväst. Paleoskoutella. Svenska Cypernexpeditionen_-_SMVK-MM-Cypern_-_C01430.tif
C06172.tif|Palatset från väster. Vouni. Svenska Cypernexpeditionen fråga fel bild kolla 617_-_SMVK-MM-Cypern_-_C06172.tif
C00577.tif|Festgeten slaktas. Vouni Svenska Cypernexpeditionen_-_SMVK-MM-Cypern_-_C00577.tif
C00757.tif|Kameler lastas med keramiklådor. Milia. Svenska Cypernexpeditionen_-_SMVK-MM-Cypern_-_C00757.tif
C03711.tif|Utsikt över Kambos dalen Soli. Svenska Cypernexpeditionen_-_SMVK-MM-Cypern_-_C03711.tif
C00927.tif|Lapithos, grävningsplatsen, Anastasia. Svenska Cypernexpeditionen_-_SMVK-MM-Cypern_-_C00927.tif
Csn098.tif|Rosa Lindros med borgmästare Kaplanis (i Lapithos) son i sitt knä. Svenska Cypernexpeditionen_-_SMVK-MM-Cypern_-_Csn098.tif
C08275.tif|V. 17 i kontorsfönstret. Stockholm Svenska Cypernexpeditionen_-_SMVK-MM-Cypern_-_C08275.tif
C06648.tif|”Cypernmuseet, huvudentrén” Stockholm. Svenska Cypernexpeditionen_-_SMVK-MM-Cypern_-_C06648.tif
C04115.tif|Reparationsarbeten i palatset. Vouni. Svenska Cypernexpeditionen_-_SMVK-MM-Cypern_-_C04115.tif
C00612.tif|Nattligt åskväder. Vouni Svenska Cypernexpeditionen_-_SMVK-MM-Cypern_-_C00612.tif
C04880.tif|Souidos i arbete. Stockholm Svenska Cypernexpeditionen_-_SMVK-MM-Cypern_-_C04880.tif
C01163.tif|Marion. T. 5, interiör Svenska Cypernexpeditionen_-_SMVK-MM-Cypern_-_C01163.tif
C01649.tif|Arbetsbild från östsluttningen. Vouni. Svenska Cypernexpeditionen_-_SMVK-MM-Cypern_-_C01649.tif
C00784.tif|Grav 1, relief. Trachonas. Svenska Cypernexpeditionen_-_SMVK-MM-Cypern_-_C00784.tif
C06083.tif|Vouni. Centralgården. Svenska Cypernexpeditionen_-_SMVK-MM-Cypern_-_C06083.tif
C09416.tif|Cypern utställningen i Historiska Museet._-_SMVK-MM-Cypern_-_C09416.tif
C04849.tif|Volvo, reklambild. Bil och kameler. Svenska Cypernexpeditionen_-_SMVK-MM-Cypern_-_C04849.tif
C00815.tif|Avfärden. Lapithos. Svenska Cypernexpeditionen_-_SMVK-MM-Cypern_-_C00815.tif
C01326.tif|Grav 69, från dromos. Marion. Svenska Cypernexpeditionen_-_SMVK-MM-Cypern_-_C01326.tif
C02288.tif|Grav 11, fyndlagret in situ. Amathus Svenska Cypernexpeditionen_-_SMVK-MM-Cypern_-_C02288.tif
15900D.tif|Fältritning. Ajia Irini. Svenska Cypernexpeditionen._-_SMVK-MM-Cypern_-_15900D.tif
C00485.tif|Volvo Svenska Cypernexpeditionen_-_SMVK-MM-Cypern_-_C00485.tif
C01482.tif|Arbetsbild. Paleoskoutella. Svenska Cypernexpeditionen_-_SMVK-MM-Cypern_-_C01482.tif
C03630.tif|Cholades. Rum XLIII A, offergropen med pinjikottar in situ, detalj. Soli. Svenska Cypernexpeditionen_-_SMVK-MM-Cypern_-_C03630.tif
C10050.tif|Polis ? Famagusta. Svenska Cypernexpeditionen_-_SMVK-MM-Cypern_-_C10050.tif
C06218.tif|Utsikt från Aletri mot väster. Soli. Svenska Cypernexpeditionen_-_SMVK-MM-Cypern_-_C06218.tif
C01758.tif|Jordprofil i Bamboulans östra del. Kition. Svenska Cypernexpeditionen_-_SMVK-MM-Cypern_-_C01758.tif
C01049.tif|Alfred Westholm, Atterman, Erik Sjöqvist och Kristos ? St. Hilarion. Svenska Cypernexpeditionen_-_SMVK-MM-Cypern_-_C01049.tif
C06015.tif|Exteriör av Cypern-huset. Stockholm. Svenska Cypernexpeditionen_-_SMVK-MM-Cypern_-_C06015.tif
C01552.tif|Rum 93, under utgrävning, mot nordväst. Vouni. Svenska Cypernexpeditionen_-_SMVK-MM-Cypern_-_C01552.tif
C03655.tif|Cholades. Rum V från väster. Soli. Svenska Cypernexpeditionen_-_SMVK-MM-Cypern_-_C03655.tif
C02309.tif|Grav 24, dromos med öppnad port. Amathus Svenska Cypernexpeditionen_-_SMVK-MM-Cypern_-_C02309.tif
C09758.tif|Bypolis. Svenska Cypernexpeditionen_-_SMVK-MM-Cypern_-_C09758.tif
C03123.tif|Rum 107 med fynd in situ. Vouni. Svenska Cypernexpeditionen_-_SMVK-MM-Cypern_-_C03123.tif
C05058.tif|Utställning på Liljevalchs Konsthall._-_SMVK-MM-Cypern_-_C05058.tif
C01806.tif|Helhetsbild. Ajia Irini. Svenska Cypernexpeditionen_-_SMVK-MM-Cypern_-_C01806.tif
C09181.tif|Cypern utställningen i Historiska Museet._-_SMVK-MM-Cypern_-_C09181.tif
C06751.tif|Michalis vid Charoupiaträdet. Vouni. Svenska Cypernexpeditionen_-_SMVK-MM-Cypern_-_C06751.tif
C03286.tif|Cementgolvet läggs över cisternen i rum 47. Vouni. Svenska Cypernexpeditionen_-_SMVK-MM-Cypern_-_C03286.tif
C01025.tif|Svenska institutet, snö. Volvo. Nicosia. Svenska Cypernexpeditionen_-_SMVK-MM-Cypern_-_C01025.tif
C02411.tif|Vivi och Stefan Gjerstad och rider kamel. Nicosia. Svenska Cypernexpeditionen fråga_-_SMVK-MM-Cypern_-_C02411.tif
C00918.tif|Maskeraden. Nicosia Svenska Cypernexpeditionen_-_SMVK-MM-Cypern_-_C00918.tif
C06764.tif|Grottan vid Fylleri. Joan du Plat Taylor avväger i grottan. Kythrea. Svenska Cypernexpeditionen_-_SMVK-MM-Cypern_-_C06764.tif
C04990.tif|Stenkvist zaponerar. Stockholm. Svenska Cypernexpeditionen_-_SMVK-MM-Cypern_-_C04990.tif
C00996.tif|Svenska institutet. Nicosia. Svenska Cypernexpeditionen_-_SMVK-MM-Cypern_-_C00996.tif
C05050.tif|Utställning på Liljevalchs Konsthall 1933. Kartan. Stockholm. Svenska Cypernexpeditionen_-_SMVK-MM-Cypern_-_C05050.tif
C01246.tif|Marion. Arbetsbild. Svenska Cypernexpeditionen._-_SMVK-MM-Cypern_-_C01246.tif
C00871.tif|Kultgropar i I, J 4-5 Idalion. Svenska Cypernexpeditionen_-_SMVK-MM-Cypern_-_C00871.tif
C05769.tif|John Lindros. Stockholm. Svenska Cypernexpeditionen_-_SMVK-MM-Cypern_-_C05769.tif
15916D.tif|Grävningstillstånd för Svenska Cypernexpeditionen gällande områden vid Pera, Khorio och Dali._-_SMVK-MM-Cypern_-_15916D.tif
C06239.tif|Utställning på Liljevalchs Konsthall 1933. Ajia Irini rummet. Stockholm. Svenska Cypernexpeditionen_-_SMVK-MM-Cypern_-_C06239.tif
C01813.tif|Arbetsbild. Ajia Irini. Svenska Cypernexpeditionen_-_SMVK-MM-Cypern_-_C01813.tif
C00410.tif|Grav 317, dromos. Lapithos. Svenska Cypernexpeditionen_-_SMVK-MM-Cypern_-_C00410.tif
C02237.tif|Karavanen med kameler drar förbi. Ajios Jakovos. Svenska Cypernexpeditionen_-_SMVK-MM-Cypern_-_C02237.tif
C01404.tif|Kultplatsen under grav 1 från öster. Paleoskoutella. Svenska Cypernexpeditionen_-_SMVK-MM-Cypern_-_C01404.tif
C00478.tif|Teatern, dans på orkestran. Soli Svenska Cypernexpeditionen_-_SMVK-MM-Cypern_-_C00478.tif
